{
  "$schema": "https://registry.alineo.tech/spec/agent.json",
  "name": "hello-agent",
  "title": "Hello Agent",
  "description": "A minimal Pi agent on node:22. Demonstrates the @alineo-labs/agent API.",
  "author": "alineo",
  "harness": "pi",
  "harnessVersion": "1.2.0",
  "provider": "nvidia",
  "model": "nvidia/nemotron-3-super-120b-a12b",
  "packages": ["git", "python3"],
  "env": {
    "NVIDIA_API_KEY": "${NVIDIA_API_KEY}"
  },
  "resources": { "cpu": "1000m", "memory": "2Gi" }
}
