{
  "$schema": "https://registry.alineo.tech/spec/agent.json",
  "name": "rlm-fanout-worker",
  "title": "RLM Fan-out Worker",
  "description": "A child spec run via `alineo spawn` — never installed directly. No alineo install, no alineo.config.json, no spawnDepth: it never calls back into alineo and Agent.spawn() force-sets its ALINEO_SPAWN_DEPTH to 0 regardless of what's here.",
  "author": "alineo",
  "harness": "pi",
  "harnessVersion": "1.2.0",
  "provider": "nvidia",
  "model": "nvidia/nemotron-3-super-120b-a12b",
  "env": {
    "NVIDIA_API_KEY": "${NVIDIA_API_KEY}"
  },
  "resources": { "cpu": "500m", "memory": "1Gi" }
}
