{
  "$schema": "https://registry.alineo.tech/spec/agent.json",
  "name": "editor",
  "title": "Editor",
  "description": "Merges every reviewer's findings, delivered under /inputs, into one report.",
  "author": "alineo",
  "harness": "pi",
  "harnessVersion": "1.2.0",
  "provider": "nvidia",
  "model": "nvidia/nemotron-3-super-120b-a12b",
  "env": {
    "NVIDIA_API_KEY": "${NVIDIA_API_KEY}"
  },
  "resources": { "cpu": "1000m", "memory": "2Gi" }
}
