{
  "$schema": "https://registry.alineo.tech/spec/agent.json",
  "name": "hello-agent",
  "title": "Hello Agent",
  "description": "A minimal Pi agent on node:22. Demonstrates the alineo API.",
  "author": "alineo",
  "categories": ["agent", "starter"],
  "harness": "pi",
  "model": "gemini-flash-latest",
  "packages": ["git", "python3"],
  "env": {
    "GEMINI_API_KEY": "${GEMINI_API_KEY}"
  },
  "resources": { "cpu": "500m", "memory": "1Gi" }
}
